{
  "sourceName": "Canada IRCC DLI",
  "jurisdiction": "CA",
  "sourceUrl": "https://www.canada.ca/en/immigration-refugees-citizenship/services/study-canada/study-permit/prepare/designated-learning-institutions-list.html",
  "releaseVersion": "2026-08-09",
  "retrievalMethod": "html",
  "licensingTermsNote": "Review current Government of Canada terms, attribution, and automated-access requirements.",
  "adapterName": "ca_ircc_dli",
  "enabled": true,
  "checksumRequired": true
}
